{
  "kind": "nautilus-basic-progression",
  "version": 1,
  "profileId": "basic-progression-v1",
  "character": {
    "version": 1,
    "id": "fixture-capped",
    "name": "Practice cap fixture",
    "stats": {
      "strength": 25,
      "endurance": 100,
      "dexterity": 35,
      "agility": 35,
      "intelligence": 40,
      "perception": 40,
      "mechanical": 15,
      "medical": 15,
      "firearms": 35,
      "heavyWeapons": 15,
      "explosives": 15,
      "leadership": 20,
      "sneak": 25,
      "climbing": 50
    },
    "resources": {
      "hp": 1,
      "ap": 0,
      "stamina": 0
    },
    "skillPoints": 7
  },
  "baseline": {
    "stats": {
      "strength": 25,
      "endurance": 99,
      "dexterity": 35,
      "agility": 35,
      "intelligence": 40,
      "perception": 40,
      "mechanical": 15,
      "medical": 15,
      "firearms": 35,
      "heavyWeapons": 15,
      "explosives": 15,
      "leadership": 20,
      "sneak": 25,
      "climbing": 50
    },
    "skillPoints": 7
  },
  "level": 1,
  "xp": 0,
  "practice": {
    "strength": 0,
    "endurance": 0,
    "dexterity": 0,
    "agility": 0,
    "intelligence": 0,
    "perception": 0,
    "mechanical": 0,
    "medical": 0,
    "firearms": 0,
    "heavyWeapons": 0,
    "explosives": 0,
    "leadership": 0,
    "sneak": 0,
    "climbing": 0
  },
  "revision": 11,
  "receipts": [
    {
      "version": 1,
      "id": "fixture-cap-0",
      "characterId": "fixture-capped",
      "revision": 1,
      "command": {
        "id": "fixture-cap-0",
        "expectedRevision": 0,
        "type": "practice",
        "source": "running",
        "sourceId": "fixture-segment-0",
        "stat": "endurance",
        "amount": 1000
      },
      "outcome": {
        "xpGained": 0,
        "levelsGained": 0,
        "pointsGained": 0,
        "pointsSpent": 0,
        "practiceGained": 1000,
        "practiceSpent": 0,
        "practiceDiscarded": 0,
        "statGains": {}
      }
    },
    {
      "version": 1,
      "id": "fixture-cap-1",
      "characterId": "fixture-capped",
      "revision": 2,
      "command": {
        "id": "fixture-cap-1",
        "expectedRevision": 1,
        "type": "practice",
        "source": "running",
        "sourceId": "fixture-segment-1",
        "stat": "endurance",
        "amount": 1000
      },
      "outcome": {
        "xpGained": 0,
        "levelsGained": 0,
        "pointsGained": 0,
        "pointsSpent": 0,
        "practiceGained": 1000,
        "practiceSpent": 0,
        "practiceDiscarded": 0,
        "statGains": {}
      }
    },
    {
      "version": 1,
      "id": "fixture-cap-2",
      "characterId": "fixture-capped",
      "revision": 3,
      "command": {
        "id": "fixture-cap-2",
        "expectedRevision": 2,
        "type": "practice",
        "source": "running",
        "sourceId": "fixture-segment-2",
        "stat": "endurance",
        "amount": 1000
      },
      "outcome": {
        "xpGained": 0,
        "levelsGained": 0,
        "pointsGained": 0,
        "pointsSpent": 0,
        "practiceGained": 1000,
        "practiceSpent": 0,
        "practiceDiscarded": 0,
        "statGains": {}
      }
    },
    {
      "version": 1,
      "id": "fixture-cap-3",
      "characterId": "fixture-capped",
      "revision": 4,
      "command": {
        "id": "fixture-cap-3",
        "expectedRevision": 3,
        "type": "practice",
        "source": "running",
        "sourceId": "fixture-segment-3",
        "stat": "endurance",
        "amount": 1000
      },
      "outcome": {
        "xpGained": 0,
        "levelsGained": 0,
        "pointsGained": 0,
        "pointsSpent": 0,
        "practiceGained": 1000,
        "practiceSpent": 0,
        "practiceDiscarded": 0,
        "statGains": {}
      }
    },
    {
      "version": 1,
      "id": "fixture-cap-4",
      "characterId": "fixture-capped",
      "revision": 5,
      "command": {
        "id": "fixture-cap-4",
        "expectedRevision": 4,
        "type": "practice",
        "source": "running",
        "sourceId": "fixture-segment-4",
        "stat": "endurance",
        "amount": 1000
      },
      "outcome": {
        "xpGained": 0,
        "levelsGained": 0,
        "pointsGained": 0,
        "pointsSpent": 0,
        "practiceGained": 1000,
        "practiceSpent": 0,
        "practiceDiscarded": 0,
        "statGains": {}
      }
    },
    {
      "version": 1,
      "id": "fixture-cap-5",
      "characterId": "fixture-capped",
      "revision": 6,
      "command": {
        "id": "fixture-cap-5",
        "expectedRevision": 5,
        "type": "practice",
        "source": "running",
        "sourceId": "fixture-segment-5",
        "stat": "endurance",
        "amount": 1000
      },
      "outcome": {
        "xpGained": 0,
        "levelsGained": 0,
        "pointsGained": 0,
        "pointsSpent": 0,
        "practiceGained": 1000,
        "practiceSpent": 0,
        "practiceDiscarded": 0,
        "statGains": {}
      }
    },
    {
      "version": 1,
      "id": "fixture-cap-6",
      "characterId": "fixture-capped",
      "revision": 7,
      "command": {
        "id": "fixture-cap-6",
        "expectedRevision": 6,
        "type": "practice",
        "source": "running",
        "sourceId": "fixture-segment-6",
        "stat": "endurance",
        "amount": 1000
      },
      "outcome": {
        "xpGained": 0,
        "levelsGained": 0,
        "pointsGained": 0,
        "pointsSpent": 0,
        "practiceGained": 1000,
        "practiceSpent": 0,
        "practiceDiscarded": 0,
        "statGains": {}
      }
    },
    {
      "version": 1,
      "id": "fixture-cap-7",
      "characterId": "fixture-capped",
      "revision": 8,
      "command": {
        "id": "fixture-cap-7",
        "expectedRevision": 7,
        "type": "practice",
        "source": "running",
        "sourceId": "fixture-segment-7",
        "stat": "endurance",
        "amount": 1000
      },
      "outcome": {
        "xpGained": 0,
        "levelsGained": 0,
        "pointsGained": 0,
        "pointsSpent": 0,
        "practiceGained": 1000,
        "practiceSpent": 0,
        "practiceDiscarded": 0,
        "statGains": {}
      }
    },
    {
      "version": 1,
      "id": "fixture-cap-8",
      "characterId": "fixture-capped",
      "revision": 9,
      "command": {
        "id": "fixture-cap-8",
        "expectedRevision": 8,
        "type": "practice",
        "source": "running",
        "sourceId": "fixture-segment-8",
        "stat": "endurance",
        "amount": 1000
      },
      "outcome": {
        "xpGained": 0,
        "levelsGained": 0,
        "pointsGained": 0,
        "pointsSpent": 0,
        "practiceGained": 1000,
        "practiceSpent": 0,
        "practiceDiscarded": 0,
        "statGains": {}
      }
    },
    {
      "version": 1,
      "id": "fixture-cap-9",
      "characterId": "fixture-capped",
      "revision": 10,
      "command": {
        "id": "fixture-cap-9",
        "expectedRevision": 9,
        "type": "practice",
        "source": "running",
        "sourceId": "fixture-segment-9",
        "stat": "endurance",
        "amount": 1000
      },
      "outcome": {
        "xpGained": 0,
        "levelsGained": 0,
        "pointsGained": 0,
        "pointsSpent": 0,
        "practiceGained": 1000,
        "practiceSpent": 0,
        "practiceDiscarded": 0,
        "statGains": {}
      }
    },
    {
      "version": 1,
      "id": "fixture-cap-10",
      "characterId": "fixture-capped",
      "revision": 11,
      "command": {
        "id": "fixture-cap-10",
        "expectedRevision": 10,
        "type": "practice",
        "source": "running",
        "sourceId": "fixture-segment-10",
        "stat": "endurance",
        "amount": 1000
      },
      "outcome": {
        "xpGained": 0,
        "levelsGained": 0,
        "pointsGained": 0,
        "pointsSpent": 0,
        "practiceGained": 1000,
        "practiceSpent": 10800,
        "practiceDiscarded": 200,
        "statGains": {
          "endurance": 1
        }
      }
    }
  ]
}
