{
  "kind": "nautilus-basic-progression",
  "version": 1,
  "profileId": "basic-progression-v1",
  "character": {
    "version": 1,
    "id": "fixture-character",
    "name": "Basic progression fixture",
    "stats": {
      "strength": 25,
      "endurance": 30,
      "dexterity": 35,
      "agility": 35,
      "intelligence": 40,
      "perception": 40,
      "mechanical": 15,
      "medical": 15,
      "firearms": 35,
      "heavyWeapons": 15,
      "explosives": 15,
      "leadership": 20,
      "sneak": 25,
      "climbing": 50
    },
    "resources": {
      "hp": 37,
      "ap": 0,
      "stamina": 6.5
    },
    "skillPoints": 2
  },
  "baseline": {
    "stats": {
      "strength": 25,
      "endurance": 30,
      "dexterity": 35,
      "agility": 35,
      "intelligence": 40,
      "perception": 40,
      "mechanical": 15,
      "medical": 15,
      "firearms": 35,
      "heavyWeapons": 15,
      "explosives": 15,
      "leadership": 20,
      "sneak": 25,
      "climbing": 50
    },
    "skillPoints": 2
  },
  "level": 1,
  "xp": 0,
  "practice": {
    "strength": 0,
    "endurance": 0,
    "dexterity": 0,
    "agility": 0,
    "intelligence": 0,
    "perception": 0,
    "mechanical": 0,
    "medical": 0,
    "firearms": 0,
    "heavyWeapons": 0,
    "explosives": 0,
    "leadership": 0,
    "sneak": 0,
    "climbing": 0
  },
  "revision": 0,
  "receipts": []
}
